Variavel,Coeficiente,StdErr,Z_stat,Odds Ratio,P-valor,Significancia,Interpretacao
const,-12.341658087556427,0.5484568912968139,-22.502512564615348,4.366022756874203e-06,3.922036439829275e-112,***,Intercepto
RWA_Credito_lag4,-46.51756092699811,2.2440069440264767,-20.72968671100924,6.27595726689955e-21,1.8700335808076834e-95,***,Maior RWA Credito REDUZ risco (protetor forte)
RWA_Mercado_lag4,-0.22484580055055942,0.26312457485038143,-0.854522237911118,0.7986393590145149,0.39281569324563603,,RWA Mercado nao significativo
RWA_Operacional_lag4,1.5654491605347727,0.9977982342995667,1.568903518489071,4.78482360724018,0.11667042192076583,,Maior RWA Operacional AUMENTA risco (direto)
Capital_Principal_lag4,-0.4489042860403208,0.044041081305363015,-10.192853416286496,0.6383271925931266,2.1340675461405437e-24,***,Maior Capital REDUZ risco (protetor moderado)
Alavancagem_lag4,-0.24661595536621758,0.038366001405831865,-6.427981711138926,0.7814407440356614,1.2930929414561298e-10,***,"Maior Alavancagem REDUZ risco (direto, contra-intuitivo)"
PIB_lag4,-0.07384107781912781,0.04047270726685024,-1.8244659872211815,0.9288192921001946,0.06808165388975704,*,Crescimento PIB REDUZ risco (protetor fraco)
Spread_lag4,0.15725635651650838,0.0349861111605741,4.494822410949199,1.1702955883493829,6.962803218854489e-06,***,Maior Spread AUMENTA risco (custo de funding)
RWA_Operacional_lag4_x_Alavancagem_lag4,1.6908986424336339,0.16489236516555666,10.254559941182984,5.424353069389841,1.1288902476389874e-24,***,INTERACAO: Risco Operacional x Alavancagem AMPLIFICA risco
